{"$schema":"https://json-schema.org/draft/2020-12/schema","type":"object","additionalProperties":false,"required":["batch_id","selector_version","input_intake_ids","records","verdict","next_permitted_action"],"properties":{"batch_id":{"pattern":"^system-one-v2-preaudit-","type":"string"},"selector_version":{"const":"system-one-selector-v2"},"input_intake_ids":{"type":"array","minItems":3,"maxItems":3,"uniqueItems":true,"items":{"pattern":"^intake-","type":"string"}},"records":{"type":"array","minItems":3,"maxItems":3,"items":{"type":"object","additionalProperties":false,"required":["intake_id","primary_source","official_data","named_gap","outcomes","disposition"],"properties":{"intake_id":{"pattern":"^intake-","type":"string"},"primary_source":{"type":"object","additionalProperties":false,"required":["url","location","finding"],"properties":{"url":{"format":"uri","type":"string"},"location":{"minLength":5,"type":"string"},"finding":{"minLength":40,"type":"string"}}},"official_data":{"type":"object","additionalProperties":false,"required":["url","location","finding"],"properties":{"url":{"format":"uri","type":"string"},"location":{"minLength":5,"type":"string"},"finding":{"minLength":40,"type":"string"}}},"named_gap":{"minLength":40,"type":"string"},"outcomes":{"type":"object","additionalProperties":false,"required":["positive","null","contrary"],"properties":{"positive":{"minLength":30,"type":"string"},"null":{"minLength":30,"type":"string"},"contrary":{"minLength":30,"type":"string"}}},"disposition":{"enum":["eligible-for-full-audit","rejected-before-full-audit"]},"failed_gate":{"enum":["actual-data-fit","prior-art","nontrivial-consequence","decisive-test","bounded-expertise"]}}}},"verdict":{"enum":["no-justified-trio","full-audit-trio-required"]},"next_permitted_action":{"minLength":30,"type":"string"}}}
