{
  "batch_id": "system-one-v2-preaudit-1",
  "selector_version": "system-one-selector-v2",
  "input_intake_ids": ["intake-chlamydomonas-mutation-blocks", "intake-possum-foraging-access", "intake-lizard-thermal-connectivity"],
  "records": [
    {"intake_id":"intake-chlamydomonas-mutation-blocks","primary_source":{"url":"https://doi.org/10.1111/evo.12448","location":"Study title and linked Dryad record","finding":"The primary study estimates fitness consequences of mutation accumulation across multiple Chlamydomonas strains; the official record links two separately identified fitness-assay blocks."},"official_data":{"url":"https://datadryad.org/api/v2/versions/12918/files","location":"Version 1 file inventory and content-endpoint receipt","finding":"The inventory lists distinct fitness-assay files and MD5s, but both official content endpoints returned a 56-byte Unauthorized JSON response on 2026-08-02, so no real rows or checksums were verified locally."},"named_gap":"Whether the reported among-strain fitness-effect inference remains stable when estimation is separated across the two documented assay blocks cannot be tested while the official content endpoint supplies no usable files.","outcomes":{"positive":"No valid positive result is permitted without the two verified assay blocks.","null":"No valid null result is permitted without the two verified assay blocks.","contrary":"No valid contrary result is permitted without the two verified assay blocks."},"disposition":"rejected-before-full-audit","failed_gate":"actual-data-fit"},
    {"intake_id":"intake-possum-foraging-access","primary_source":{"url":"https://doi.org/10.1016/j.anbehav.2025.123195","location":"Abstract and study design","finding":"The study manipulated bait access at 40 sites and reports that bush-rat visits and foraging declined with possum visits."},"official_data":{"url":"https://datadryad.org/api/v2/versions/301579/files","location":"Version 5 inventory and Photo_Behaviours2.csv content-endpoint receipt","finding":"The inventory lists site-by-night camera events, but the official listed content endpoint returned a 56-byte Unauthorized JSON response on 2026-08-02."},"named_gap":"The proposed access-versus-observed-visit separation would both restate the primary study's intervention analysis and lacks accessible event rows for an independent check.","outcomes":{"positive":"No valid positive result is permitted without verified event rows.","null":"No valid null result is permitted without verified event rows.","contrary":"No valid contrary result is permitted without verified event rows."},"disposition":"rejected-before-full-audit","failed_gate":"actual-data-fit"},
    {"intake_id":"intake-lizard-thermal-connectivity","primary_source":{"url":"https://doi.org/10.1111/1365-2656.13814","location":"Methods 2.4.2 and Discussion","finding":"The experiment manipulated climate and habitat connectivity for three years; population models reset time to zero after extinction and interpret connectivity as altering warming consequences."},"official_data":{"url":"https://datadryad.org/api/v2/versions/203045/files","location":"Version 4 inventory and content-endpoint receipt","finding":"The inventory lists population data and analysis code with source-issued digests, but both tested content endpoints returned a 56-byte Unauthorized JSON response on 2026-08-02."},"named_gap":"The effect of resetting time after a population extinction cannot be tested without verified population rows and analysis code.","outcomes":{"positive":"No valid positive result is permitted without verified population rows.","null":"No valid null result is permitted without verified population rows.","contrary":"No valid contrary result is permitted without verified population rows."},"disposition":"rejected-before-full-audit","failed_gate":"actual-data-fit"}
  ],
  "verdict": "no-justified-trio",
  "next_permitted_action": "Retain all three acquisition failures, stop this V2 source batch, and source a contrasting trio whose official contents can be checksum-verified before structural construction."
}
